,date,tweet,nlikes,label,prob_neg,prob_pos,state_code
172837,2019-12-01 19:43:06,bringing old policy like ubi futuristic policy like thorium nuclear energy light version plan includes private dont know put clearly far left may seem country catch get math youtubeandrewyang,1.0,2,0.07096716,0.9290328,CA
172838,2019-11-30 21:36:19,nuclear energy carbon free,1.0,0,0.92550594,0.07449404,CA
172839,2019-11-27 19:18:18,part really like yang hope public perception using nuclear energy change quickly,2.0,2,0.00713567,0.99286425,CA
172843,2019-11-24 00:40:40,read informative article think nuclear energy solution climate new generation iv nuclear different old nuclear wa surprised see really look option 🌎 httpstcotzsumsl,6.0,0,0.9648962,0.035103783,CA
172844,2019-11-21 14:13:35,seriously hawaii ha turd water ability clean island ringed poo water nuclear energy would awesome clean wastewater hawaii,0.0,2,0.12355263,0.8764473,CA
172845,2019-11-20 03:38:33,like every time read nuclear energy‘s standard operating procedure like “oh hey leftover kept carefully monitored maintenanced pristine environment thousand year biggie” i’m like wait surely can’t right yet,0.0,0,0.55426544,0.44573453,CA
172846,2019-11-15 04:39:53,nuclear energy emits zero carbon science cause least harm human data ha strength power world need entire third world thirst advancement fact yet enviros ignore science data fact doesn’t make denier,0.0,0,0.97087806,0.029121883,CA
172847,2019-11-15 04:29:27,nuclear energy emits zero carbon science cause least harm human data ha strength power world need entire third world thirst advancement fact yet enviros ignore science data fact doesn’t make denier,0.0,1,0.51912206,0.48087794,CA
172848,2019-11-13 23:02:46,nuclear energy doe emit co green house gas could use blockchain jedi buy nuclear power grid hybrid power grid make u resilient congrats promotion,0.0,0,0.9240261,0.07597391,CA
172849,2019-11-05 20:41:54,literally anticorporation terrorist fighting nuclear energy,7.0,0,0.97543097,0.024569053,CA
172850,2019-11-04 19:52:28,nuclear energy renewable energy nuclear waste last basically forever disagree completely,2.0,0,0.9658594,0.034140613,CA
172851,2019-11-02 23:22:00,nuclear energy emits zero carbon science cause least harm human data ha strength power world need entire third world thirst advancement fact yet enviros ignore science data fact doesn’t make denier,1.0,0,0.97837204,0.02162796,CA
172852,2019-10-30 17:11:28,nuclearenergy research happening sacramento knew energy innovation sactech,0.0,2,0.05953854,0.9404615,CA
172853,2019-10-29 20:17:29,invest safe healthy clean world kid supporting nuclear energy nothing else replace fossil fuel,1.0,2,0.36515906,0.63484097,CA
172854,2019-10-29 03:36:40,ignorance left astounding fire california produced ten time carbon emission effort reduce saved assuming carbon issue nuclear energy viable solution produce none france nuclear,1.0,2,0.06268698,0.9373131,CA
172855,2019-10-24 23:05:11,want nuclear energy bc climate change fullstop hate war nuclear weapon nuclear imperialism amp inequality marginalized system core bc usgovothers evil amp transparent doesn’t mean science demonized love respect u,7.0,2,0.112389915,0.88761014,CA
172856,2019-10-20 19:25:51,anytime show punishment humanity gross misuse nuclear energy whatever thats protector earth apocalypse figure coming start thing,1.0,0,0.99071467,0.009285306,CA
172857,2019-10-16 23:08:01,fuck bernie sander homies little bitch imagine afraid nuclear energy boy hasnt heard thorium 🤣🤣,1.0,0,0.9361678,0.06383227,CA
172858,2019-10-10 22:40:09,wrote nooner way leaving people pissed want trump bogeyman much say wont fit character one thing wa rightwe probably need nuclear energy,0.0,0,0.91838396,0.08161606,CA
172859,2019-10-05 18:28:16,thank you’re amazing nuclear energy need part climate mitigation strategy crisis it’s partisanship it’s renewable v nuclear it’s stopping climate change full stop,5.0,1,0.5423749,0.45762506,CA
172860,2019-10-04 06:08:05,must get rid nuclear weapon instead utilize nuclear energy environment amp economic interest could key piece north korea negotiation ha key positive future greennucleardeal cc,1.0,2,0.049978536,0.9500215,CA
172861,2019-10-03 19:16:30,awe incredible project working long believed nuclear power answer climate change society fear nuclear energy need addressed head revolutionary tech,0.0,0,0.61349535,0.38650465,CA
172863,2019-10-01 19:20:44,need look nuclear energy 🙌🌎🚀 httpstcopsakfry,25.0,2,0.36780685,0.63219315,CA
172864,2019-10-01 19:12:32,carbon capture nuclear energy help reduce carbon footprint new green deal 💁🏻‍♂️💁🏻‍♂️💁🏻‍♂️,0.0,0,0.97861266,0.021387296,CA
172865,2019-10-01 00:56:35,thorconpower nuclearenergy realitycheck httpstcoqtvndmqbo,1.0,0,0.8269727,0.17302728,CA
172866,2019-09-28 18:09:16,power electric vehicle electricity produced electric power plant fuel source coal oil natural gas nuclear energy produce heat heat used boil water create steam,0.0,0,0.94049215,0.059507858,CA
172867,2019-09-28 00:51:57,look nuclear expensive expected surprise one ever said nuclearenergy climatechange invest solarenergy,0.0,0,0.9530864,0.046913557,CA
172868,2019-09-27 19:35:04,love watching documentary like strongly suggest checking insidebillsbrain amazing much get done wealthy people use money influence good love nuclear energy httpstcopumaatysks,1.0,2,0.3309984,0.66900164,CA
172869,2019-09-27 05:23:47,look france france ha majorly shifted nuclear energy nuclear france’s main energy source—emissions went windsolarelectric germany’s main energy source— emission went electricity powered coal,0.0,0,0.69179845,0.30820152,CA
172870,2019-09-27 05:20:00,green new deal doe include nuclear energy bill even though nuclear ha proven much much safer general public perceives today especially technological advancement last half century,0.0,0,0.95357645,0.046423588,CA
172871,2019-09-27 05:17:54,windsolarelectric viable option nationwide reduction emission look germany example however modern nuclear energy technology ha proven much powerful reliable energy source known mankind unfortunately,0.0,0,0.95451087,0.04548916,CA
172872,2019-09-26 14:39:32,solar nuclear energy million mile transmission system,4.0,0,0.58848405,0.411516,CA
172873,2019-09-25 00:22:45,anyone disagrees it’s called bullying also care much curbing emission isn’t visiting china india two biggest cause isn’t promoting nuclear energy feel like scam 🤷🏻‍♂️,2.0,2,0.2207899,0.7792101,CA
172874,2019-09-24 18:11:59,nuclear energy,2.0,0,0.9781401,0.021859828,CA
172875,2019-09-20 03:59:26,cory booker latest remark boosting nuclear energy highlight growing rift party controversial energy source httpstcovtmaxtxjm via,0.0,2,0.019453133,0.9805469,CA
172876,2019-09-17 19:15:50,“there slightest indication nuclear energy ever obtainable would mean atom would shattered will” —albert einstein,23.0,0,0.957516,0.04248404,CA
172877,2019-09-16 17:24:36,diabolically nuclear energy “solve” fake climate crisis without advancing socialism httpstcomexezsuahu,1.0,2,0.019936498,0.98006356,CA
172878,2019-09-16 16:34:25,late amazing podcast they’re spot nuclear energy nothing intrinsically wrong theoretical concept ☢️ yet calculate long term storage spent fuel it’s currently deeply subsidized form energy solarwindbattery keep evolving,0.0,2,0.0071858433,0.9928141,CA
172879,2019-09-12 17:39:51,fairness texas could come wind nuclear greenpeace want get rid nuclear energy we’re back coal guess,56.0,2,0.04077426,0.9592257,CA
172880,2019-09-10 15:31:27,nuclear energy safe look row tank holding unmanageable poison absurdity powerlessness astounding worrying microplastics radioisotope fish plate going extra spicy httpstcoafelulvb,0.0,0,0.92188704,0.07811296,CA
172881,2019-09-09 09:10:39,idea nuclear energy clean evil get keep nuclear waste read kate brown chernobyl please corporate wickedness,0.0,0,0.97979933,0.020200644,CA
172882,2019-09-08 03:42:33,thinking dont like nuclear energy make much wast dont need sell electricity make moving electricity circle home like pumping blood body using windmill generator electric motor make work somehow,0.0,2,0.10120444,0.89879555,CA
172883,2019-09-06 01:05:08,dear american continue eat meat use straw use nuclear energy natural gas amp yes fossil fuel get economy moving forward see brain thank next,11.0,0,0.98119813,0.018801883,CA
172885,2019-09-05 00:09:50,want nuclear energy also allow table le bad option know destroying civilization,3.0,2,0.26012757,0.73987246,CA
172886,2019-08-31 20:03:33,look andrew yang also open nuclear energy true aoc httpstcoqyvbbrw,116.0,2,0.051989038,0.948011,CA
172887,2019-08-31 17:22:42,next episode common sense theater find genius dotard analysis nuking hurricane quite perplexing stop wind rain powerful force nuclear energy would heighten force kinetic prevalence laced radiated wind 🙃,0.0,1,0.5026319,0.49736807,CA
172888,2019-08-31 13:45:14,nuclear energy,0.0,2,0.3607625,0.6392375,CA
172889,2019-08-30 21:58:51,nuclear energy lead nuclear energy unfortunately perfectly flawed human decide happens application thereafter scalpel used cutting well healing depends whether wielder ha educated hand good heart httpstcovkhnrcbb,16.0,2,0.2332769,0.76672304,CA
172890,2019-08-27 00:09:25,thought advanced design nuclear energy,20.0,2,0.008487946,0.991512,CA
172891,2019-08-26 19:58:44,scared death ‘word’ nuclear—have knowledge variety memory fear meltdown amp russia accident hiding willing learn safe nuclear energy,1.0,0,0.94595116,0.054048833,CA
172892,2019-08-26 14:22:15,nuclear energy doesnt produce greenhouse gas thats good environment,1.0,2,0.13946217,0.8605378,CA
172893,2019-08-04 23:43:14,nuclear energy future radioactive contamination conveniently ignored hanford mile island chernobyl burned malibu reactor neglected “regulators” fukushima still burning “peace atoms” excuse worse useless nuclear weapon submarine leaking,1.0,2,0.44438592,0.55561405,CA
172894,2019-07-28 11:45:24,someone really concerned environment would pushing nuclear energy used excuse nuclear weapon hanford mile island chernobyl fukushima still burning since waste radioactive year state want stored one,0.0,2,0.36780685,0.63219315,CA
172895,2019-07-26 18:20:32,need people become nuclear physicist help solve problem co emission personally think nuclear energy best bet want save world go school,5.0,0,0.6536279,0.34637213,CA
172896,2019-07-25 02:19:19,lie nei wa unbiased subject nuclear energy credible report put forth nei acknowledged saying credible redundant,0.0,2,0.004569537,0.99543047,CA
172897,2019-07-22 18:39:37,mr president addition top land based electric generation system ha adapted naval ship propulsion system fossil fuel nuclear energy drive ship hoping receive message keeping invention secretconfidential usa,0.0,2,0.010549215,0.98945075,CA
172898,2019-07-22 11:08:08,drilling clearcutting nuclear energy plan waste toxic year,0.0,2,0.062262565,0.9377374,CA
172899,2019-07-17 01:23:25,talk role play supportive community advanced reactor developer engage level nuclear energy ecosystem facility operation safeguardsbydesign waste management inmm httpstconkjlvjkuv,0.0,0,0.99251306,0.0074869664,CA
172900,2019-07-16 02:08:19,nuclear energy antibiotic space exploration personal computer smartphones arguably allowed bring dog workplace single greatest thing come last year,2.0,2,0.18246748,0.81753254,CA
172901,2019-07-15 20:08:34,france’s reminds u euratom treaty safeguard also research development cooperative effort add article treaty call use nuclear energy improve life european citizen inmm,1.0,0,0.9762039,0.02379605,CA
172902,2019-07-15 15:40:43,bill gate face daunting nuclear energy future httpstcometodndtx,0.0,0,0.94921845,0.0507815,CA
172903,2019-07-13 18:06:18,bitcoin always survive hash raspberry pisonly greatest invention st century time see world bitcoin mined pp nuclear energy derivative data mined pp data center,4.0,2,0.05391085,0.94608915,CA
172904,2019-07-11 09:46:02,yet harnessing one’s anger great feat controlling one’s energetic romantic passion it’s clean nuclear energy harnessed properly course you’re right devastating there’s leak much like nuclear energy i’m risk averse though 🤷🏽‍♀️,0.0,0,0.900591,0.09940903,CA
172905,2019-07-10 00:16:22,nerd point serious discussion global warming must include nuclear energy,0.0,0,0.9725868,0.027413227,CA
172906,2019-07-08 21:39:50,i’ll start taking climate change serious lefty start taking nuclear energy seriously amp stop virtue signaling intersectionality sham legislation ha zero chance passing legislature amp signed,0.0,2,0.021763533,0.9782365,CA
172907,2019-07-06 20:01:25,might well mention france “model” nuclear energy closing plant faster building,0.0,2,0.31338528,0.6866147,CA
172908,2019-07-03 00:02:14,im sure relative chinese died dam failure different opinion debate irrelevant brainwashed majority never allow nuclear energy instead die congratulation win,0.0,0,0.7712536,0.22874641,CA
172909,2019-06-28 17:19:23,nuclear energy reliable,0.0,0,0.98976666,0.010233387,CA
172910,2019-06-28 15:43:42,many ilk opposed nuclear energy,0.0,0,0.88014877,0.11985122,CA
172911,2019-06-27 04:50:17,lean towards criminal justice reform alla cut nuclear energy climate change ill adjust tinfoil hat,0.0,2,0.0021431067,0.9978569,CA
172912,2019-06-22 06:07:17,don’t understand guy couldn’t remember doe clue doe qualified run every fossil nuclear energy company perfect httpstcoqzrqtipshf,1.0,2,0.06373164,0.9362684,CA
172913,2019-06-22 05:54:11,solution nuclear waste amp end sight cost manage waste amp keep safe long term cost never included cost evaluation nuclear energy add price anderson act insurance indemnification subsidy tax payer back,1.0,2,0.36826164,0.6317384,CA
172914,2019-06-22 05:47:56,nuclear energy clean deadly spent fuel safe clean could store basement however nrc won’t let happen nei nuclear propaganda machine lying,1.0,1,0.54283595,0.45716408,CA
172915,2019-06-18 00:19:52,need nuclear energy please explain attack neutral country’s oil tanker ha verified,0.0,0,0.93226725,0.067732714,CA
172916,2019-06-14 17:36:39,“alex trembath ecomodernism green new deal case nuclear energy longread qampa” httpstcojmmkwari,0.0,2,0.099350765,0.9006492,CA
172917,2019-05-31 06:21:01,way destroy nuclear energy human go extinct would massive meltdown thousand year later assuming damage wa done plant there’s gotta protocol destroy right watching much chernobyl,1.0,0,0.9555979,0.04440212,CA
172918,2019-05-30 07:17:38,first learned spill college class one main reason im nuclear energy saw lot horrific mining accident many forgotten one always stuck dont believe safe way mine uranium,2.0,0,0.9845675,0.015432433,CA
172919,2019-05-29 03:24:44,nuclear energy one answer climate change got bad deal mile island 👍,0.0,0,0.8982431,0.1017569,CA
172920,2019-05-28 03:23:11,“instead using mix renewables nuclear energy classed lowcarbon power source” wtf nuclear energy classed lowcarbon lowcarbon stop negative propaganda asap,1.0,2,0.019439451,0.98056054,CA
172921,2019-05-27 18:09:26,sunny warm memorial day first time went without even windbreaker coat deep inside sun heat generated eventually radiated u earth nuclear energy isnt bad,0.0,0,0.9426614,0.05733858,CA
172923,2019-05-20 07:39:57,“i spent month reassuring american public nuclear energy u nuclear industry particular wa safe wa starting doubt claim myself“ democrat gop energy,0.0,0,0.96760577,0.032394215,CA
172924,2019-05-18 15:40:34,don’t forget nuclear energy,1.0,2,0.27449015,0.7255099,CA
172925,2019-05-13 18:00:40,africa’s nuclear energy ambition leapfrogging unknown httpstcowqlxrfowt,0.0,0,0.90452236,0.095477685,CA
172926,2019-05-12 03:57:05,without kicking carbon curb aka embracing nuclear energy need get big gun lot ammo protect unprepared denier motor home able move weather goodtimes,1.0,0,0.9898375,0.01016246,CA
172927,2019-05-11 00:52:03,would great actually pit forth plausible realistic legislation help climate work moving u forward safe nuclear energy exists work help create incentive electric vehicle amp innovation stop pushing disguised socialist agenda,1.0,0,0.79216677,0.20783322,CA
172928,2019-05-11 00:51:52,would great actually pit forth plausible realistic legislation help climate work moving u forward safe nuclear energy exists work help create incentive electric vehicle amp innovation stop pushing disguised socialist agenda,1.0,2,0.41008544,0.58991456,CA
172929,2019-05-10 02:50:44,tweeted answer time calling nuclear energy technology finally office sound like going broker business scum,0.0,2,0.08038248,0.9196175,CA
172930,2019-05-08 17:46:10,stop grandstanding get narcissistic propose actual realistic legislation help something give epa teeth fight bad co push safe nuclear energy promote alternative etc,0.0,0,0.9452188,0.054781213,CA
172931,2019-05-08 05:54:01,watched first episode chernobylhbo rabbit hole conspiracy theory nuclear energy go night 🤦‍♀️,4.0,2,0.028837249,0.9711628,CA
172932,2019-05-06 17:59:47,democrat staunchly nuclear energy practical costefficient safe solution energy need far youve proposed unrealistic impractical socialist nonsense,0.0,0,0.8153946,0.18460542,CA
172933,2019-05-06 04:34:34,lost “transition away domestic use nuclear energy need nuclear energy fulfill energy need “ true think fossil fuel company touting renewables want fossil back even say tv ad,0.0,0,0.9633182,0.036681816,CA
172934,2019-05-03 21:46:57,without r process without plutonium least may life developed nuclear fissionfusion level would without nuclear energy,1.0,0,0.9580095,0.04199056,CA
172935,2019-05-02 17:51:09,interesting mention saudi arabia interested developing nuclear energy realize oil doe limit done new reactor design without worry weapon,0.0,2,0.16503027,0.83496976,CA
172936,2019-04-28 13:38:53,youre smart guy bill without nuclear energy year turn around ignoring powerful safest clean energy source,0.0,2,0.17563485,0.82436514,CA
172937,2019-04-21 15:13:04,understand black magick twisted thing add electricity nuclear energy know get difficult point discern,1.0,2,0.18108171,0.81891835,CA
172938,2019-04-12 22:38:14,amy need power country low cost energy never discus nuclear energy power europe i’m saying yes discussion,0.0,0,0.98547506,0.014524899,CA
172939,2019-04-09 22:40:50,used work research end nuclear energy exactly experience insofar tell useful nuclear power depends assumption topic diverse regression analysis metallurgy amp sociology platonic ideal wedge issue,2.0,2,0.33532166,0.6646784,CA
172940,2019-04-09 15:50:19,nuclear energy always way budget ha massive potential safety risk may safe environment everyone constantly looking take extra precaution every step budget approval manager committee want reject cya,1.0,2,0.15619998,0.84380007,CA
172941,2019-04-06 22:03:01,agree nuclear energy need another serious look safety ha improved considerably it’s reliable relatively inexpensive greenhouse gas missing climatechange nuclear,1.0,2,0.0033143798,0.9966857,CA
172943,2019-04-04 21:45:26,need regulation location away coast away earthquake fault line proximity citizen security disposal safety energy safety net power plant fail avoid black etc nuclear energy something serious,0.0,2,0.28204277,0.71795726,CA
172944,2019-04-01 16:59:17,saving existing nuclear important innovating towards advanced nuclear reactor probably important glad see nuclear energy leadership act reintroduced impressive set cosponsors latest httpstcolokmidsru,35.0,0,0.98144364,0.018556336,CA
172945,2019-03-29 11:01:08,“from lede trump administration ha kept secret seven authorization ha issued since november allowing u nuclear energy company share sensitive technological information saudi arabia”,0.0,0,0.97875094,0.021249088,CA
172946,2019-03-28 22:03:59,replacement fossil fuel lot nuclear energy solar power wind power energy pump plenty idea communitychoice energy plan would make going renewable cost effective solution passion,0.0,0,0.5764882,0.42351177,CA
172947,2019-03-28 12:14:06,consider saw give nuclear energy,4.0,1,0.5422177,0.45778236,CA
172948,2019-03-28 05:53:10,httpstcotndwftldr doe help google search nuclear waste nuclear energy bet change mind danger store coal burning waste backyward,0.0,0,0.90722454,0.09277543,CA
172949,2019-03-21 03:58:10,come strong technology proactive best bill gate ai like “nuclear weapon nuclear energy” danger promise httpstcobmuvyrxxh,0.0,0,0.99409854,0.005901511,CA
172950,2019-03-20 19:00:25,bill gate ai like “nuclear weapon nuclear energy” danger promise httpstcocnscirsnzi via httpstcoaonhypwwyk,1.0,0,0.962156,0.037843954,CA
172951,2019-03-10 01:15:57,right nuclear energy reduced discontinued country next year global basis favor renewables france japan u germany etc httpstcopgsjnz,0.0,2,0.022676839,0.9773232,CA
172952,2019-03-07 21:00:46,sanjayan explores change perception nuclear energy climate lab’s fifth episode🌿 full episode available online at… httpstcovaeudowvhr,2.0,1,0.5391598,0.46084023,CA
172953,2018-09-26 14:41:01,good announcement bad announcement two nuclearenergy startup httpstcorxgrboiil tech,0.0,0,0.97037446,0.02962553,CA
172954,2018-08-27 17:59:56,rogertaylor played hesoundedgreat played aqueensong duh verycool taylorhawkins singsprettydamnwell man thatdudeleavesitallupthere nuclearenergy queen foofighters… httpstcokedevfd,1.0,2,0.3293538,0.67064625,CA
172955,2017-12-08 17:42:58,nuclear energy nothing scared technology prevails wheres carbonite electricvehicles smash republican,1.0,0,0.9494559,0.050544087,CA
172956,2017-06-15 15:22:11,nuclear energy production tax credit markup today httpstcowlvxboj,0.0,2,0.0056987507,0.9943012,CA
172957,2017-01-28 03:06:02,first i’m cheering greenpeace i’m agreeing dick cheney something that’s nuclear energy httpstcovdprzeori,2.0,0,0.9850553,0.014944735,CA
172958,2016-11-03 14:23:13,power item day flaming carrot mask powered doctor heller nuclear energy… httpstconhpzufgdn,0.0,2,0.13946217,0.8605378,CA
172959,2015-04-21 06:33:24,nuclear energy bad u us iran us thats cool gay life matter u right,0.0,0,0.65013415,0.34986582,CA
172960,2015-04-15 04:16:16,obama help iran invest green energy instead nuclear energy oh wait doesnt really believe say,0.0,2,0.258602,0.74139804,CA
172961,2015-03-14 18:17:29,told iran legit helping combat isisisil gesture good faith nuclear energy,1.0,2,0.0027244473,0.99727553,CA
172962,2015-03-10 23:04:54,nobody answer need nuclear energy first place,0.0,2,0.0027900855,0.99720997,CA
172963,2015-03-09 21:53:44,thanks follow following u fast breeder nuclear energy,0.0,0,0.9706015,0.029398438,CA
172964,2015-03-09 11:49:43,climate warming advocate u support renewable nuclear energy fast breeder reactor bcuz likely u keep open mind,1.0,2,0.2129909,0.7870091,CA
172965,2015-03-06 17:01:35,need nuclear energy think,0.0,2,0.2269819,0.7730181,CA
172966,2015-03-03 17:13:13,rice either ignorant dishonest nuclear energy want,1.0,2,0.015329088,0.9846709,CA
172967,2015-02-15 00:13:53,supporting geoengineering nuclear energy dismissing recycling homeopathy b,1.0,1,0.4722897,0.5277103,CA
172968,2015-01-25 20:54:58,nuclear deal biggest achievement modi far mile stone field nuclear energy india need badly,0.0,2,0.26156753,0.73843247,CA
172969,2015-01-13 04:49:11,people ranting nuclear energy want clean solar power wtf know level energy amp toxic waste generated making,0.0,0,0.99409854,0.005901511,CA
172970,2014-12-28 15:21:26,realnuclearwasteconfidence would nice amp responsible continue nuclear energy magic wont work,0.0,0,0.9825493,0.017450733,CA
172971,2014-12-25 04:55:47,plot dawnoftheplanetoftheapes san francisco powered nuclear energy,0.0,2,0.4295559,0.5704441,CA
172972,2014-12-17 19:26:22,ha cuz need energy nuclear energy though diet love burger pasta hope everything good,1.0,0,0.86579984,0.13420014,CA
172973,2014-11-19 16:14:48,safest place nuclear energy produced sun,0.0,0,0.9212093,0.078790724,CA
172974,2014-11-15 17:35:39,“khameneiir iran considers use wmd unforgivable sin nuclear energy nuke none yeah sure,0.0,2,0.099350765,0.9006492,CA
172975,2014-11-15 16:16:39,mmmrtkhameneiir iran considers wmd unforgivable sin nuclear energy nuke none httpstcomxmjmoaguq irantalks,0.0,1,0.48765334,0.5123467,CA
172976,2014-11-01 17:10:20,listen init nuclear energy lumberjvck remix pantheon np soundcloud crazy trap set httpstconffwqpgxb,1.0,0,0.97097605,0.029023949,CA
172977,2014-10-29 14:44:20,america navy unsung hero nuclear energy httptcofiburhfh,0.0,2,0.07659492,0.9234051,CA
172978,2014-09-29 21:20:15,russian always fucking around microwave nuclear energy,0.0,0,0.5539248,0.4460752,CA
172979,2014-09-16 03:28:09,healthcare nd regulated industry next nuclear energy mhealth mobilemonday,0.0,0,0.9280192,0.07198078,CA
172980,2014-08-20 19:30:56,let ensure rhetoric match reality hassanrouhani seek end unnecessary crisis nuclear energy program,0.0,0,0.9793594,0.020640574,CA
172981,2014-07-22 04:22:03,nuclear energy alternative supplement status quo source subsidized renewables httptcoxrpoudr,0.0,0,0.95274466,0.047255304,CA
172982,2014-07-17 01:25:13,guy sitting next flight wa reading nuclear energy uncomfortable,2.0,0,0.9182634,0.08173664,CA
172983,2014-07-13 23:30:30,guess lebrons bigger nuclear bomb least nuclear energy haha,0.0,0,0.9865165,0.013483528,CA
172984,2014-07-12 21:16:31,think manipulation nuclear energy wa big mistake part,1.0,2,0.3607625,0.6392375,CA
172985,2014-06-30 05:49:59,called nuclear energy clean energy youre mind wake,1.0,0,0.5508051,0.44919497,CA
172986,2014-06-08 02:42:24,dont care caused look chernobyl come nuclear energy seems primitive today,0.0,0,0.99065745,0.009342548,CA
172987,2014-05-02 15:51:19,wish vocal support nuclear energy california need nuclear table,1.0,2,0.1425461,0.85745394,CA
