,date,tweet,nlikes,label,prob_neg,prob_pos,state_code
80802,2013-02-12 15:15:22,nuclear energy definitely solution lot future problem long dont blow get,0.0,2,0.21712562,0.7828744,LA
80803,2012-02-09 16:16:09,depends iran would willing nuclear energy program international control,0.0,0,0.9523971,0.04760294,LA
80804,2011-09-21 07:08:35,whenlifegivesyoulemons concentrate harnessing nuclear energy conquer world lemon mass destruction,0.0,2,0.06834666,0.9316534,LA
80806,2011-04-29 19:38:11,rt fear nuclear energy stall kentucky nuclear plan httpbitlymnbla httpmylocmejcizv,0.0,2,0.27318168,0.72681826,LA
80807,2011-03-25 11:53:54,thing clean coal safe nuclear energy yeah got wrong side bed,0.0,2,0.0069448906,0.99305516,LA
80808,2011-03-12 16:56:43,european environmentalist reliably bring crazy rt french green call end nuclear energy httptcoyhhug,0.0,0,0.6575366,0.3424633,LA
80809,2011-03-12 15:42:55,coal bad idea nuclear energy safest form enough coal meet rising demand growing population,0.0,2,0.30656743,0.6934325,LA
80810,2010-09-14 23:59:44,thorium new nuclear energy fix httpbitlybtaw via httpoutsidein,0.0,2,0.0021330186,0.997867,LA
82746,2020-07-05 04:36:36,per factcheck article deal allowed rosatom russian nuclear energy agency acquire controlling stake uranium one canadianbased company mining stake western united state u could withdrawn mining permit thats,0.0,0,0.8982436,0.10175645,KY
82750,2017-05-28 14:14:29,unionboilermakers lockedout westinghouse nh nuclearenergy ibb u solidarity nhlegislators newhampshire healthcare httpstcolrbbgui,1.0,1,0.5466338,0.45336625,KY
82751,2016-02-24 21:32:36,mick mastilovic manager nuclear fuel supply tva presented information nuclear energy… httpstcoofvhpfmu,0.0,0,0.9464451,0.053554922,KY
82752,2012-11-17 08:30:39,nuclear energy part kentucky future httptcogzvgtyx via httptcomhnczdgq,0.0,0,0.66650385,0.33349612,KY
82754,2011-03-28 19:59:42,know nuclear energy expensive think learn kygreentv httpbitlyggedz,0.0,0,0.86777294,0.13222712,KY
82755,2011-03-13 02:21:20,cnn interviewing bill nye science guy nuclear energy appropriate credential,0.0,0,0.821175,0.17882498,KY
88797,2020-11-28 05:18:46,nuclear energy 👍,3.0,2,0.41384023,0.5861597,KS
88810,2020-11-24 22:52:08,well dont think biden presidency kind nuclear energy development,1.0,2,0.12689601,0.8731039,KS
88826,2020-10-19 17:48:16,wa way safely dispose spent nuclear waste nuclear energy would good environment really big catch phase would willingly volunteer backyard waste disposal site especially sun amp wind available😉,1.0,0,0.9756294,0.024370633,KS
88830,2019-12-30 15:39:09,httpstcowqogjqhyn huge key climate issue complement nuclear energy strategy it’s doable need mass persuasion 😊👍🐂☘️,0.0,2,0.22354077,0.7764593,KS
88831,2019-12-24 02:57:39,see hf hafnium hafnium used attractor conductor nuclear energy see type person able control conduct abstract idea word imagery plus energetic personality could power city years💚,0.0,0,0.9652968,0.034703176,KS
88833,2019-09-23 18:25:44,exactly i’m decreasing pollution cleaning ocean environment best ability without going overboard banning plastic straw renewable resource nuclear energy i’m buying fear mongering involved climate change,0.0,1,0.5448084,0.45519155,KS
88834,2019-09-10 16:39:46,watched chernobyl quite nervous spending day security joke wolf creek nuclear energy center burlington k httpstcouusghpzny,1.0,2,0.38588786,0.6141121,KS
88838,2019-03-12 01:11:22,may biased fan nuclear energy,6.0,2,0.38881743,0.6111826,KS
88842,2014-04-30 06:43:52,ever tired cant sleep type five page paper nuclear energy youll fall right asleep,1.0,0,0.8103052,0.1896948,KS
88845,2013-05-09 19:21:39,yeah wolf creek nuclear energy center httptcoiqscnwirz,0.0,2,0.21345758,0.7865424,KS
88846,2013-04-09 23:13:19,im pretty good squeezin tight spot wolf creek nuclear energy center httptcohfrngzse,0.0,2,0.082109794,0.91789025,KS
88847,2013-01-08 16:10:08,going go nuuuuuuculeeeeeeer wolf creek nuclear energy center httptcosxylg,0.0,0,0.950784,0.049215898,KS
88854,2011-04-13 21:01:37,leak well whew wolf creek nuclear energy center httpsqcomgqiotq,0.0,0,0.98637253,0.013627448,KS
88859,2011-01-18 15:59:54,im wolf creek nuclear energy center ox ln burlington httpsqcomefkk,0.0,2,0.16207059,0.83792937,KS
91551,2020-11-27 15:21:50,iran ha literally never nuclear weapon program ha always civilian nuclear energy prgram fact isnt really even contested say whatever want country long official u designated bad actor nobody stop,1.0,2,0.2207899,0.7792101,IA
91554,2020-09-06 04:22:29,dealing alteration phase spent nuclear fuel separating actinide daughter product recycling safe proper manner many challenge path overcome face new era nuclear energy spicyscience,2.0,2,0.3353324,0.6646676,IA
91555,2020-04-19 08:56:07,it’s lindsey explaining nuclear energy cause watching chernobyl,0.0,0,0.9871105,0.012889544,IA
91556,2020-02-19 21:34:04,second motion amp climate emergency b distracting dealing real issue land management prevent wildfire specie recovery nuclear energy could replace far fossil fuel technology electricity large ship building,452.0,0,0.98904246,0.0109575195,IA
91557,2020-01-15 19:16:26,he’s still dissatisfied buttigieg said remains vague dislike even bernie’s plan think nuclear energy ha part solution given scale problem,6.0,2,0.0029597625,0.9970402,IA
91558,2019-12-20 01:54:09,yes anyone claim care climate change loses credibility nuclear energy clean energy yanggang yang,2.0,1,0.5492062,0.45079386,IA
91559,2019-12-20 01:51:16,tomsteyer really want what’s best planet he’s purposely spreading dated misinformation nuclear energy he’s heavily invested wind amp solar c’mon that’d crazy demdebate,3.0,0,0.58499026,0.4150097,IA
91560,2019-08-06 14:10:32,happens take away car coal ethanol nuclear energy still climate change,21.0,0,0.98254657,0.017453413,IA
91561,2019-03-27 12:51:11,doubt environment without stopping economy move back paper bag le use plastic electric car nuclear energy energy efficient code future building really need sq ft home,0.0,0,0.97179407,0.0282059,IA
91562,2015-04-02 20:44:29,reason nuclearenergy awesome httpstcoavhadirzhf nuke energy climatechange destroys amp nucleartalks go,0.0,0,0.98423845,0.01576153,IA
91563,2015-04-02 20:39:56,nuclearenergy terrible httpstcobbycinhl climatechange ravage earth amp nucleartalks go remember fact,0.0,0,0.9631375,0.036862455,IA
91564,2015-03-26 13:36:10,nuclearenergy explained doe work httpstcomxhxjbczk irantalks open nuclear energy mean energy,0.0,0,0.97246605,0.027533883,IA
91566,2013-12-11 01:34:56,documentary nuclear energy really good,0.0,2,0.22327739,0.7767226,IA
91567,2013-06-11 05:41:08,indeed much public enmity utilizing nuclear energy stem disaster avoided necessary safety precaution,1.0,0,0.983633,0.016367052,IA
91568,2012-03-30 18:13:24,fuck nuclear energy cancer manmade disease rtsciam radioactive iodine fukushima found california kelp httptcolour,0.0,2,0.104101904,0.89589804,IA
91570,2011-04-27 09:44:34,poll iowan key point proposed nuclear energy bill httpbitlygvslf via httpoutsidein,0.0,2,0.15752062,0.8424794,IA
91571,2011-02-20 11:14:08,boy scout earn nuclear energy merit badge duane arnold httpbitlyeejmu palo iowa,0.0,0,0.99081504,0.009184955,IA
96673,2020-11-27 23:02:04,odd logic reach renewable electricity reduce associated emission best way approach zero emission replace remaining fossil fuel small modern nuclear nuclear energy fact change change mind,1.0,2,0.004147654,0.99585235,IN
96674,2020-11-27 21:00:58,large figure alright uk legacy waste st generation graphite moderated andor reprocessed fuel relevant irish nuclear energy wed surely include cost decommissioning waste storagedisposal cost nuclear electricity centkwh,1.0,2,0.3890078,0.61099225,IN
96675,2020-11-27 11:15:53,would useful keep background information mind reading study httpstcowgbygnjgsh,0.0,0,0.9657679,0.034232065,IN
96676,2020-11-26 06:21:24,opinion nuclear energy,0.0,2,0.08971363,0.9102864,IN
96678,2020-11-23 14:43:26,hope would shame fixation something renewable delay preclude another affordable low emission solution need decarbonise surely important desire renewable,1.0,0,0.99492055,0.005079391,IN
96679,2020-11-23 11:36:29,good point would ensure grid power rese grid renewable best could include anything fossil fuel gas clean british french nuclear clean would impact treatment renewable product,1.0,0,0.96712697,0.032873034,IN
96680,2020-11-23 11:01:14,sound promising market oxygen well hydrogen following electrolysis water based dedicated onshore windfarm surplus offshore wind,1.0,2,0.12518613,0.8748139,IN
96681,2020-11-22 23:18:15,report say based dedicated mw offshore wind farm earlier eirwind study show possible production cost lt €kg amp delivery cost €€kg hydrogen mw wind farm h production facility competitive diesel subsidy httpstcodrbtqt httpstcoakzanudnp,2.0,0,0.64111906,0.358881,IN
96682,2020-11-22 16:11:59,nuclear hermann forget subsidy loss leading green energy new russian unit run french nuclear energy government dept would give u power zero emission risk year running time stop wasting ink paper go nuclear,1.0,0,0.9885096,0.011490447,IN
96683,2020-11-22 16:09:33,clear report author able answer question,1.0,0,0.93070996,0.06929003,IN
96684,2020-11-22 13:15:40,research show hydrogen produced advanced nuclear likely superior produced wind solar reason include relative space required material usage cost ireland lack seasonal storage also factor httpstcovnmzmjm httpstcocryvbgygb,1.0,0,0.8938158,0.10618423,IN
96685,2020-11-22 13:07:04,report point serious question regarding competitiveness green hydrogen httpstcozjaaqxdx,1.0,0,0.9923993,0.0076007424,IN
96689,2020-09-26 13:50:46,im reading 📖 “combating corrosion world’s aging nuclear reactors” via chemistry news ⁦cenmag⁩ app nuclearenergy moltensaltreactor httpstcokfhinso,1.0,0,0.67885685,0.32114318,IN
96690,2020-09-07 04:04:01,terrorism sewn gop administration bent destabilizing middle east federal gov’t investing nuclear energy amp renewable energy source power country alongside state govt’s,0.0,0,0.98748523,0.012514761,IN
96691,2020-08-17 11:39:42,closest ever get free nuclear energy converting mass energy e mc squared,1.0,2,0.114421226,0.8855788,IN
96692,2020-06-23 17:54:54,nuclear engineer often find friend asking whether use nuclearenergy decarbonize grid bc climatechange thats really great question important thing remember need arrest cop killed breonna taylor,157.0,2,0.005196739,0.99480325,IN
96694,2020-04-14 20:51:01,congratulation undergrad dalton stanley shannon ford recipient neup fellowship provide fund student participate work related nuclear energy,19.0,0,0.932046,0.06795393,IN
96695,2020-04-02 16:52:44,“the promise peril nuclear power” ⁦gizmodo⁩ climatechange netzeroemissions nuclearenergy httpstcorsuhfbmujg,0.0,0,0.62257767,0.37742236,IN
96696,2020-03-28 22:18:00,thermonuclear hell nah nuclear energy bird 🤣😴😴🥴 🎶sonic energy🎶,1.0,0,0.6271996,0.37280035,IN
96697,2020-03-07 20:29:23,bernie dilemma nuclear waste three state nuclear reactor it’s something ha bothered immensely nuclear energy isn’t clean energy bc there’s problem nuclear waste,0.0,0,0.8777774,0.12222256,IN
96698,2019-12-07 08:50:46,said nearly zero comparison flat true much worse nuclear energy difference suffering waste nuclear waste stay u one seems give fuck people suffering,2.0,2,0.36814606,0.63185394,IN
96699,2019-12-01 15:54:34,cant forget couldnt name branch gov didnt realize would also oversee nuclear energy secty energy total ineptness behalf,4.0,0,0.9679832,0.032016825,IN
96700,2019-11-23 00:04:51,thought nuclear energy go indiana httpstcoxnjdfgesd,0.0,0,0.8881576,0.11184231,IN
96701,2019-11-20 05:34:32,don’t think rule carbon free energy source win fossil fuel company getting u bicker nuclear energy still majority energy pocket,4.0,0,0.9095004,0.09049952,IN
96703,2019-10-09 20:51:43,wednesday mean interesting seminar speaker happy welcome dr lyon former assistant secretary nuclear energy nrc commissioner purduenuclear seminarwednesday httpstcodujlgwfqq,4.0,0,0.9607687,0.039231297,IN
96706,2019-09-07 19:09:04,nuclear energy it’s bad coal,0.0,2,0.15775727,0.8422427,IN
96707,2019-09-04 17:29:23,pizza chatting nuclear energy doesnt get much better thank much atomsforhumanity panelist taking time chat student takegiantleaps purdue purduewhatif httpstcognik,6.0,2,0.008528814,0.99147123,IN
96708,2019-09-03 22:27:30,“i credit founder finding innovation mind set nuclear energy seeking incremental improvement step change people” takegiantleaps httpstcoomwoiomtwx,0.0,0,0.94716966,0.052830312,IN
96709,2019-09-03 21:56:41,exciting see production helping tell amazing story nuclear energy energyinnovation,3.0,2,0.1136255,0.88637453,IN
96711,2019-07-12 01:04:38,need push towards nuclear energy renewables get better please give warren nomination,14.0,2,0.06402514,0.93597484,IN
96712,2019-06-17 18:51:02,except cant dont produce enough power nuclear energy ha drawback risk reactor meltdown pathetically low transition nuclear hopefully fusion point supplement replace renewables eventually,1.0,0,0.9272797,0.0727203,IN
96713,2019-06-17 00:07:17,nuclear energy,0.0,0,0.5740714,0.42592856,IN
96714,2019-04-10 23:11:34,call nuclear energy clean think waste leaf behind,1.0,0,0.98955077,0.010449188,IN
96715,2019-04-06 01:30:18,solar energy much safer nuclear energy,0.0,2,0.43369672,0.56630325,IN
96716,2019-03-29 06:26:22,yeah agree slipping radar rick perry still energy secretary first didnt know job included nuclear energy cant make stuff,0.0,2,0.25388923,0.74611074,IN
96717,2019-03-22 18:19:00,nuclear energy may good source energy would take trillion dollar clear mess reactor make,0.0,0,0.9762849,0.023715131,IN
96718,2019-03-14 17:06:15,devonte green like nuclear energy best metaphor describe iubb,0.0,0,0.93470895,0.06529104,IN
96719,2018-09-08 20:42:11,need decarbonize grid personally love nuclear energy along solar wind despite difference still riseforclimate bc agree… httpstcoizymrmndr,4.0,0,0.9296822,0.07031778,IN
96720,2015-02-07 05:23:49,persuade general public nuclear energy safe save million dollar,0.0,0,0.6328438,0.36715618,IN
96721,2015-01-08 11:16:06,sb new provides project involving construction nuclear energy production generating facilit httptcofgkobttpf,0.0,2,0.020801216,0.9791988,IN
96722,2014-11-19 03:20:46,watched china syndrome tutorial jane fonda gtgtgtgt also learned little nuclear energy,0.0,0,0.9246793,0.07532074,IN
96724,2014-03-04 17:33:01,nuclear energy ill tell u lot potential literally,4.0,2,0.007138465,0.99286157,IN
96726,2014-01-27 21:06:04,sb update nuclear energy project httptcoegptbkxty,0.0,2,0.0050821267,0.99491787,IN
96727,2014-01-14 16:56:08,sb new nuclear energy project httptcoegptbkxty,0.0,0,0.97678167,0.023218337,IN
96728,2013-12-16 12:16:05,brownsburg toastmaster learning nuclear energy plumbing bet youre wishing httptcorkyngaz,0.0,2,0.4288453,0.5711548,IN
96729,2013-04-18 18:12:37,nuclearenergy badidea wats happening scheme something sound like,0.0,0,0.9138871,0.086112946,IN
96730,2013-04-04 01:49:35,“thekoreaherald u expects nuclear energy deal seoul httptcowujokckdm southkorea”,0.0,2,0.040432356,0.9595677,IN
96731,2013-04-03 07:16:19,sb update nuclear energy facility httptcoczdsbex,0.0,0,0.9707445,0.029255532,IN
96732,2013-04-02 15:26:04,sb update nuclear energy facility httptcoczdsbex,0.0,0,0.95682335,0.043176685,IN
96733,2013-01-29 21:16:20,sb update nuclear energy facility httptcoqxll,0.0,0,0.7018076,0.29819244,IN
96734,2013-01-12 21:26:06,sb update nuclear energy facility httptcoqxll,0.0,0,0.68877304,0.31122693,IN
96735,2013-01-11 01:16:10,sb new nuclear energy facility httptcoqxll,0.0,2,0.2754602,0.72453976,IN
96736,2012-09-08 06:20:14,let em repair fix electrical unit front home let think nuclear energy,0.0,1,0.4930438,0.50695616,IN
96737,2012-05-10 19:23:04,im sensing nuclear energy test,0.0,1,0.5275935,0.4724065,IN
96738,2011-03-30 15:09:13,french addressing reliance nuclear energy light japan crisis,0.0,0,0.9914068,0.008593176,IN
103012,2020-11-29 20:47:03,naive thing ive ever heard jacob think iran producing nuclear energy peaceful purpose got kidding,1.0,0,0.90941477,0.09058528,IL
103013,2020-11-28 13:52:48,israeli war crime somehow iran’s entitled nuclear energy america israel entitled nuclear energy nuclear bomb hypocrisy israel cia mossad trump terrorism,0.0,0,0.67547417,0.3245259,IL
103014,2020-11-28 00:11:28,nuclear energy isnt everyone httpstconeziaaqjw,0.0,2,0.38166916,0.6183309,IL
103015,2020-11-28 00:00:42,don’t nuclear energy program,0.0,0,0.7698737,0.23012632,IL
103018,2020-11-27 18:32:07,th grade science class learning nuclear energy teacher thought wa great idea show movie first time movie made scared sleep,20.0,0,0.94716966,0.052830312,IL
103019,2020-11-27 15:57:12,iran ha nuclear energy program nuclear weapon program retract lie,1644.0,2,0.072476454,0.9275235,IL
103020,2020-11-27 15:25:54,entire series reporting past show pattern involving nuclear energy nuclear arm,15.0,2,0.06500304,0.934997,IL
103021,2020-11-27 13:54:59,aocs green new deal failed mention fracking nuclear energy doesnt end b year fossil fuel amp agribiz subsidy need seek nonpartisan solution heal environment httpstcokekxxha,6.0,0,0.97665554,0.023344375,IL
103024,2020-11-27 00:58:04,argument ha used since dawn nuclear tech ’s world came cold war without nuclear apocalypse possibility fairly low ironically nuclear energy may answer climate change dependence fossil fuel,0.0,0,0.97190213,0.02809784,IL
103026,2020-11-25 19:30:05,woman men il nuclearenergy workforce embody spirit giving year round proof httpstcowexybywkt httpstcolqmmqg,2.0,2,0.13659087,0.86340916,IL
103027,2020-11-25 18:36:22,thank recognizing greatness french nuclear energy world httpstcoqkwrqoshi,1.0,2,0.11004524,0.8899548,IL
103028,2020-11-25 15:28:19,til bill amp melinda gate solved nuclear energy track save earth trump casually cast aside tariff tiff,0.0,2,0.40949526,0.59050477,IL
103029,2020-11-24 19:58:38,nuclear energy tribal working group doe group strengthen relationship around nuclearrelated activity amp stem education engages w tribe reservation ancestral land near national lab reactor amp transportation route waste httpstcoyazymgsl httpstcourmimex,4.0,2,0.10331584,0.89668417,IL
103030,2020-11-24 19:20:29,doe nuclear fit progressive agenda outline nuclear energy aligns progressive value lovering spoke ans virtual winter meeting follow thread view full video clip httpstcougwdjlvcdb nuclearisgood httpstcohoplpzzoj,8.0,2,0.28446782,0.7155322,IL
103031,2020-11-24 18:00:45,virtual lesson project amp nuclear energy tribal working group aim increase stem opportunity native american tribe includes shipping dprinted clip student turn smartphonestablets microscope httpstcosbksnbguis httpstcougixbhzyt,14.0,0,0.9840783,0.015921723,IL
103032,2020-11-24 17:54:11,relative start arguing politics nuclear doesn’t divide fact could bring together recognition nuclear energy’s value carbonfree energy source side aisle httpstcocwkpltbtn,1.0,2,0.013344898,0.9866551,IL
103033,2020-11-24 05:37:28,mitigation key nuclear energy fracking carbon capture technology talking climate change real it’s absolutely world ending,2.0,0,0.9773382,0.022661772,IL
103034,2020-11-24 05:31:58,following fbi search home ohio puco chairman resigns httpstcotpexrchn via need redo puco bill nuclear energy ohio hb,0.0,2,0.112389915,0.88761014,IL
103035,2020-11-24 04:51:19,fear nuclear energy,0.0,0,0.88149834,0.11850168,IL
103036,2020-11-23 15:02:45,policywise obviously never happen biden admin ubi commit ditching fossilfuel industry amp switch entirely clean energy ban new sale gaspowered vehicle wind solar hydro nuclearenergy,0.0,2,0.2651971,0.73480284,IL
103041,2020-11-22 17:29:52,chuck truly supported nuclear energy wouldn’t working alternative energy,1.0,2,0.26676247,0.73323756,IL
103044,2020-11-22 14:25:29,isabelle nuclear energy influencer ha ability make boring topic interesting delivery weird style httpstcohlomwicies,5.0,2,0.053204227,0.9467958,IL
103047,2020-11-07 22:24:35,beaut watch lid trump warpath “breaking everything sight” fulfilling putin’s wish list highup exec branch member fired week nuclear energy oil amp gas thank chatterjee httpstcoriupatei,0.0,0,0.97753114,0.02246886,IL
103048,2020-10-29 15:27:15,nuclear energy get,3.0,2,0.039732464,0.96026754,IL
103049,2020-10-28 16:46:32,vanguard recalled voting happens split decision say we’re debating nuclear energy,0.0,2,0.025481874,0.9745181,IL
103050,2020-10-23 03:35:05,itd cool could talk nuclear energy country without everyone going cold war hysteria,11.0,0,0.9032956,0.09670437,IL
103051,2020-09-18 13:28:34,folk involved nuclear energy that’s definitely wild west collection seems like day could kind thing take stuff home wa fine haha,0.0,2,0.27629167,0.7237084,IL
103052,2020-09-16 15:52:53,natural nuclear energy,13.0,1,0.5353433,0.4646567,IL
103053,2020-09-10 05:15:13,pro nuclear energy stan acct,1.0,0,0.9770626,0.022937361,IL
103054,2020-09-08 04:18:05,afraid nuclear energy afraid engineer contractor trimming skimping afraid nuclear waste chernobyl,1.0,0,0.8055603,0.19443971,IL
103057,2020-08-28 01:57:03,thank michael madigan political machine il suffered today byron nuclear plant staple northern region illinois facility alone employee roughly individual nuclear energy one cleanest form energy done right,2.0,0,0.8067383,0.1932617,IL
103058,2020-08-27 15:38:00,sad day seeing two big nuclear energy plant closing,0.0,0,0.98317796,0.016821995,IL
103059,2020-08-26 01:36:36,lot harder il improve air quality meet climate goal maintain strong economy without taking full advantage existing cleanenergy resource windenergy nuclearenergy solarenergy,1.0,1,0.5423749,0.45762506,IL
103060,2020-08-25 18:57:13,lot harder il improve air quality meet climate goal maintain strong economy without taking full advantage existing cleanenergy resource windenergy nuclearenergy solarenergy,0.0,0,0.9664552,0.033544753,IL
103061,2020-08-21 01:16:31,im nuclear energy henry moore sculpture site first controlled nuclear reaction chicago il httpstcoajjldsnyx,0.0,0,0.65462106,0.34537897,IL
103063,2020-08-10 16:33:59,kinzinger discus covid racial injustice nuclear energy amp school httpstcoigyqber via absentadam faketeletownhall,5.0,2,0.20963328,0.79036677,IL
103065,2020-07-16 04:53:30,“the cost generating solar power range per megawatt hour mwh wnisr said onshore wind power come – per mwh nuclear energy cost ” httpstcoqgbaiihjn,0.0,0,0.6035367,0.3964633,IL
103067,2020-05-29 00:14:36,bio say nothing working industry never worked commercial nuclear industry doe highlight u navy experience well current academic amp scientific pursuit stand education stand science nuclear energy,2.0,2,0.2718262,0.7281738,IL
103068,2020-05-28 01:09:51,annual capacity factor absolutely amazing beautiful nuclear energy,4.0,0,0.75496113,0.24503888,IL
103069,2020-05-14 02:44:11,left start supporting nuclear energy,4.0,2,0.22236322,0.77763677,IL
103070,2020-04-16 02:18:56,nuclear energy technology solar energy technology communication technology aka g software technology long joe biden wa appointed front man deal affair ukraine worth mentioning,0.0,0,0.5576933,0.4423067,IL
103072,2020-04-11 15:17:07,running variation without reformer henry moore nuclear energy exercise seemed apropos ohthehumanity reformerpilates pilatesinweirdplaces httpstcocmsqehdpc,1.0,2,0.00533512,0.9946649,IL
103074,2020-03-21 12:52:54,flashback three year ago mrcathlab nuclearenergy chicago perhaps greatest cathlab electrophysiology travelnurse combo ever seen history of… httpstcoafllhgir,0.0,2,0.40089142,0.5991086,IL
103076,2020-03-01 23:02:16,decent enough weather bike ride hyde park hit brunch majanivegancuisine ran favorite dancer irenechsiao nuclear energy sculpture httpstcosepfwk,3.0,0,0.9681682,0.031831864,IL
103077,2020-01-14 19:38:25,israel believed begun fullscale production nuclear weapon following sixday war built first operational nuclear weapon december nuclear energy israel israel operates nuclear research reactor ha nuclear power plant,0.0,2,0.10475007,0.8952499,IL
103078,2020-01-03 06:48:17,nuclearenergy sculpture ⛏ henry moore 👨🏻‍🎨 🏫 site first selfsustaining nuclear chain reaction ☢️ dec physicist enrico fermi amp team 🧑‍🔬 started atomicage httpstcoduernzl,0.0,2,0.41942966,0.5805703,IL
103079,2019-12-10 00:19:40,big thanks taking panel nuclear energy evening globalaffairslive httpstcoexrwqfnvmp,7.0,0,0.9534978,0.046502195,IL
103082,2019-11-25 00:56:13,antifuel lefty enjoy blood fuel electric car i’m alternative form energy also think negative medium hide since doesn’t fit agenda need nuclear energy httpstcozyytwlwyia,9.0,0,0.95558745,0.044412524,IL
103083,2019-11-24 15:30:12,don’t always agree outside efficient clean nuclear energy definitely served together grandfather told politics break family it’s best ignore difference i’m proud served amp extended military fam,2.0,2,0.37871104,0.62128896,IL
103086,2019-11-03 00:02:43,nuclear energy solution safe solution clean safe renewable energy like wind solar geothermal,0.0,2,0.41661772,0.5833823,IL
103087,2019-10-25 15:03:16,cant remember exactly part cuz got real technical know scene ppl playing bridge ash wa probs fake wa mad fact make seem like nuclear energy use still dangerous unnecessary,1.0,0,0.91119856,0.088801384,IL
103088,2019-10-25 14:01:08,friend boyfriend work nuclear powerplant coworkers detest chernobyl say show overly biased nuclear energy inaccurate lol,3.0,0,0.9831267,0.01687335,IL
103089,2019-10-18 15:36:31,part make way chicago colleague would gladly like show around explain nuclear energy work it’s rather simple yet fascinating process opinion,11.0,0,0.5902807,0.40971932,IL
