,date,tweet,nlikes,label,prob_neg,prob_pos,state_code
6983,2020-11-30 04:28:21,wouldnt wild reporting iran nuclear program routinely referenced art iv npt state unequivocally signatory retain inalienable rightto develop research production amp use nuclear energy peaceful purpose wo discrimination,204.0,2,0.29003268,0.7099674,NY
6984,2020-11-29 16:46:00,presidentelect joe biden come office time phasing fossil fuel critical trillion climate plan includes support development nuclear energy current state nuclear energy u httpstcodyzewfwk httpstcodcentkfqu,6.0,2,0.35114226,0.6488577,NY
6985,2020-11-29 02:54:34,mohsen fakhrizadeh wa father iran’s nuclear weapon program father civil nuclear energy you’re saying iran ha many individual you’re actually saying iran never abandoned nuclear weapon program rather continued work,1.0,0,0.9206521,0.07934787,NY
6986,2020-11-29 02:17:03,expand nuclear energy invest fusion,11.0,2,0.38166916,0.6183309,NY
6987,2020-11-29 02:16:47,expand nuclear energy invest fusion,3.0,0,0.96021277,0.039787196,NY
6988,2020-11-28 17:54:55,wait thought wa nuclear energy program media’s narrative change,0.0,2,0.25978693,0.74021304,NY
6989,2020-11-28 17:45:07,process need additional tweaking whether relying human judgment best option luminary like spoken potential downside gate compared ai nuclear energy simultaneously dangerous full possibility,0.0,2,0.012224565,0.98777544,NY
6990,2020-11-28 13:54:20,nuclear energy,0.0,2,0.2575695,0.7424305,NY
6991,2020-11-27 23:55:42,peaceful nuclear energy signed deal acknowledging right iaea say full compliance “screwing us” mind,62.0,2,0.0874605,0.91253954,NY
6992,2020-11-27 23:55:36,peaceful nuclear energy signed deal acknowledging right iaea say full compliance “screwing us” mind,53.0,0,0.9898164,0.010183588,NY
6993,2020-11-27 19:51:25,iran original member nuclear nonproliferation treaty israel ha never signed npt refuse iran nonmilitary nuclear energy program rigorously monitored earth israel nuclear weapon arsenal regulated,1656.0,0,0.9653921,0.03460787,NY
6994,2020-11-27 18:36:47,weapon spelled “energy” wrong nuclear energy program retract,0.0,0,0.9881021,0.011897911,NY
6995,2020-11-27 17:33:23,say joe manchin good forging agreement across aisle thing like raising energy efficiency standard construction code modernizing nuclear energy regulation could actually pas vote divided senate,5.0,1,0.45042586,0.54957414,NY
6996,2020-11-27 17:08:26,im sorry iran know going nuclear energy,0.0,1,0.45042586,0.54957414,NY
6997,2020-11-27 15:15:00,presidentelect joe biden come office time phasing fossil fuel critical trillion climate plan includes support development nuclear energy current state nuclear energy u httpstcodyzeogns httpstcoinrtrpr,4.0,2,0.006260598,0.99373937,NY
6998,2020-11-27 11:41:39,inakamitsu delivered video message afcone wgdd winafricas virtual meeting african women’s contribution development peaceful us nuclear energy noting genderequality vital securing commonfuture👉 httpstcoqbsgdmgg httpstcoetjrfvytb,8.0,0,0.9961498,0.0038502687,NY
6999,2020-11-27 00:45:46,wont create greenhouse gas greenies oppose nuclear energy get sun wa produced nuclear energy,2.0,0,0.97207737,0.027922614,NY
7000,2020-11-26 20:19:29,mr low iq man aren’t one polluting planet fact developed nation one green minded one invented nuclear energy solar energy electric vehicle space travel move heavy industry earth nice try though,5.0,2,0.124333486,0.87566656,NY
7001,2020-11-26 20:19:25,mr low iq man aren’t one polluting planet fact developed nation one green minded one invented nuclear energy solar energy electric vehicle space travel move heavy industry earth nice try though,1.0,0,0.97434616,0.025653798,NY
7002,2020-11-26 18:45:00,presidentelect joe biden come office time phasing fossil fuel critical trillion climate plan includes support development nuclear energy current state nuclear energy u httpstcodyzewfwk httpstcojjrwhimau,3.0,2,0.051989038,0.948011,NY
7003,2020-11-26 16:09:51,ive put minute research nuclear energy downside ha nothing script im working,1.0,2,0.18967795,0.81032205,NY
7004,2020-11-26 14:55:55,mission theoretical physic find proof new particle physical property prove truth fact universe one example nuclear energy,2.0,0,0.94771284,0.052287135,NY
7005,2020-11-26 04:58:39,like man secretary energy charge nuclear energy program,0.0,2,0.25372183,0.7462782,NY
7006,2020-11-25 14:45:00,presidentelect joe biden come office time phasing fossil fuel critical trillion climate plan includes support development nuclear energy current state nuclear energy u httpstcodyzeogns httpstcowhplohlu,12.0,2,0.09505611,0.9049439,NY
7007,2020-11-25 09:13:19,let ask member u house congress reject energy water appropriation act would allow consolidated interim storage ci facility nuclear waste tx nm httpstcoqlqfsatq via nuclearthreat nuclearenergy nuclearwaste,0.0,2,0.00823463,0.9917653,NY
7008,2020-11-25 08:50:17,maintaining reliable abundant affordable electricity improves life socioeconomic population nuclear energy benefit renewable energy benefit elite,2.0,0,0.60909975,0.3909003,NY
7009,2020-11-24 22:33:47,arecibo nuclear energy high mass star november sky climate change brightest star select video httpstcoijcbgmca,2.0,0,0.842891,0.15710896,NY
7010,2020-11-24 21:06:44,versatile test reactor vtr built idaho national laboratory support research development new nuclear energy technology httpstcowbcohvvq,1.0,2,0.06455194,0.93544805,NY
7011,2020-11-24 18:46:17,think nuclear energy httpstcotggbwel,0.0,2,0.25388923,0.74611074,NY
7012,2020-11-24 17:03:28,state nuclear energy today — lie ahead httpstconautthbof,0.0,0,0.7390036,0.2609964,NY
7013,2020-11-24 15:45:00,presidentelect joe biden come office time phasing fossil fuel critical trillion climate plan includes support development nuclear energy current state nuclear energy u httpstcodyzeogns httpstcougfajhihk,7.0,0,0.9881021,0.011897911,NY
7014,2020-11-24 00:34:43,iomabb apamistamab cd targeted antibody coupled powerful nuclear energy kill cancer cell millimeter amp shown good safety profile alx cd developed alxo toxicity could major issue,0.0,2,0.015664715,0.9843353,NY
7015,2020-11-23 22:19:07,joebiden trump year disaster thing hope continue expand ramp pressure china front keep artemis build space infrastructure invest nuclear energy esp newer safer reactor design,0.0,0,0.9842338,0.015766222,NY
7016,2020-11-23 20:54:22,exactly doe mean don’t use nuclear energy don’t understand,0.0,2,0.07627293,0.9237271,NY
7017,2020-11-23 20:28:53,don’t use nuclear energy,0.0,2,0.03452602,0.965474,NY
7018,2020-11-23 19:08:52,adopt france stance allowing country run primarily nuclear energy hopefully,0.0,2,0.1078392,0.89216083,NY
7019,2020-11-23 16:01:01,httpstcombhlnomxl nuclearenergy decarbonisation,0.0,2,0.24479343,0.7552066,NY
7020,2020-11-23 14:34:30,going win climate change war must embrace nuclear energy,1.0,2,0.3050277,0.6949723,NY
7021,2020-11-21 17:53:34,“green new deal” doesn’t robustly endorse incorporate nuclear energy farce,1.0,0,0.8749556,0.12504436,NY
7022,2020-11-21 16:34:48,don’t mean i’ve reached right wing position going left center left disagree timeline proposed gnd well lack nuclear energy amp understanding still need petroleum coal natural gas product beyond energy,0.0,2,0.3104376,0.6895624,NY
7023,2020-11-21 13:51:55,coronavirus presidential transition presidential power use force guantanamo closure supreme court – human right litigation nuclear energy weapon nuremberg trial mali colombia nagornokarabakh conflict united nation phew httpstcobehrkisqc,15.0,0,0.9575298,0.042470213,NY
7024,2020-11-18 14:41:54,interesting fact dept energy courtesy matt yglesias democratic energy secretary like work renewables republican one want promote oil department’s budget actually nuclear weapon nuclear energy,1.0,0,0.95210093,0.04789905,NY
7025,2020-11-11 19:23:12,unga plenary session iaea🇮🇩reaffirms commitment strengthening nuclear safetyampsecurity look forward enhancing coop promote use nuclear energy peaceful purpose 🇮🇩 pleased continue cosponsoring report iaea inidiplomasi httpstcovfwextdk,7.0,1,0.47026235,0.52973765,NY
7026,2020-10-27 15:55:45,want know pathetically specious environmental movement imagine wanting lower carbon footprintamp nuclear energy,0.0,2,0.19931956,0.80068046,NY
7027,2020-10-17 22:23:29,nuclear energy fusion much better improved fission ok probably better path httpstcoxpjt,2.0,2,0.19887547,0.8011246,NY
7028,2020-09-26 05:33:43,nuclearenergy smart need look greenpeace see ingrained dogma many environmentalist fear mongering successfully shaped public opinionampwe haven’t upgraded nuclear energy capacity decades—how get progress nuclearmatters,3.0,2,0.0040507927,0.99594915,NY
7029,2020-08-08 18:13:19,i’m sure exhaust wa diesel since sub powered nuclear energy doesn’t exhaust longer stealthy operation,1.0,0,0.6296157,0.37038425,NY
7030,2020-06-03 13:22:00,ty correction i’ve distracted antitrust litigation vegan skin care business it’s time ngo soliciting email donation unequivocally oppose aspect nuclearenergy nuke direct threat sustainable future,1.0,0,0.99630785,0.0036921476,NY
7031,2020-05-02 01:12:54,damn youre dumber thought sorry wasted time work web design say poor nation dont need broadband nuclear energy work fine wtf lol damn man good luck,1.0,0,0.97753793,0.022462053,NY
7032,2020-02-10 17:54:53,hot take wasting time working working nuclear energy instead,0.0,0,0.9535373,0.04646274,NY
7033,2020-02-07 18:37:22,one hypothetically get stronger nuclear energy died old time bullet hard decision,0.0,2,0.003289427,0.99671054,NY
7034,2020-01-25 11:30:22,maintaining openmind temporary nuclear energy isn’t endorsement nuclear energy best longterm solution ha recognized reality transition away fossil fuel offshore wind would better interim,2.0,2,0.019601775,0.98039824,NY
7035,2020-01-02 12:57:11,st sentence interesting article us weasel word directly “because nuclear energy doe require burning fossil fuel doe directly contribute co emission climate change” co uranium mining enrichment,0.0,0,0.90941477,0.09058528,NY
7036,2019-12-26 11:50:13,later became head “safety” mr burn wanted quell nuclear energy protest homer started also old lisa simpson riding school book saxophone like big deal 👍🏼 promoting safe route school safer street amp clean energy 😀,1.0,2,0.4468816,0.5531184,NY
7037,2019-12-20 01:43:16,wind solar battery nuclear energy democraticdebates,0.0,2,0.037004493,0.9629955,NY
7038,2019-12-20 01:41:29,since ha nuclear energy affordable demdebate,0.0,0,0.9760275,0.023972504,NY
7039,2019-12-01 17:53:56,far one biggest disappointment among democratic field lack support nuclear energy serious fighting climate change reducing emmisons nuclear really one viable option transition renewables,58.0,2,0.34600762,0.65399235,NY
7040,2019-11-30 23:04:57,like delaney half field cause support nuclear energy,1.0,0,0.89425653,0.10574351,NY
7041,2019-11-20 00:13:12,kingdom saudiarabia stress right country peaceful use nuclearenergy accordance standard set forth international atomic energy agency strict supervision,0.0,2,0.07335482,0.92664516,NY
7042,2019-11-07 12:54:31,article passed house bill ban u mining near grand canyon say “ nuclearenergy power produce carbon emissions” conveniently ignoring mining ton carbon amp enrichment u fuel grade u ton carbon,0.0,0,0.90176415,0.098235816,NY
7043,2019-10-23 14:01:53,proponent nuclear energyampam pretty sure design tested computer v sliderule u nuke plant design r old😳 would safer however made great point cleanenergy option r le expensive— get cadillac need chevy,5.0,2,0.021491218,0.9785088,NY
7044,2019-10-22 21:59:18,good idea simple solution reforestation nuclear energy problem solved,1.0,2,0.060914252,0.9390858,NY
7045,2019-10-09 23:47:33,turkey allied russia nuclear energy partner thanks american technology provided know,1.0,2,0.42892435,0.5710757,NY
7046,2019-09-28 16:18:10,disagree nigeria afford even nuclear energy nigeria afford lack rather embrace education possibility rule go amsterdam nw ger see many farmer citizen using solar panel,0.0,2,0.29333425,0.70666575,NY
7047,2019-09-25 01:42:57,used work world’s largest renewable energy company climate change debacle wa solved long ago ie nuclear energy,1.0,2,0.1545998,0.8454002,NY
7048,2019-09-25 01:29:53,usambeu sondland productive bilateral meeting romanian minister foreign affair unga diversifying romania’s energy mix expanding peaceful civil nuclear energy romania increasing energysecurity region httpstcovtxnsss,95.0,1,0.54105633,0.4589437,NY
7049,2019-09-21 19:49:55,without echo chamber must retweet analysis incredibly uninformed cory booker nuclearenergy,2.0,0,0.6676803,0.33231968,NY
7050,2019-09-05 12:38:54,however bernie support research nuclear energy agree ha detail plan getting fossil fuel earlier including plan depth speaks th average american car trade compensation displaced worker contd,0.0,2,0.03584502,0.96415496,NY
7051,2019-09-05 01:58:42,bernie nuclear energy it’s actually expensive use cnn correspondent even told france used nuclear climatetownhall least mentioned geothermal,0.0,0,0.9781748,0.021825228,NY
7052,2019-08-26 16:12:17,yo republican come get boy lmao he’s bout waste nuclear energy mother nature 🤣🤣🤣🤣🤣,2.0,2,0.28960454,0.71039546,NY
7053,2019-08-15 03:04:48,nuclear energy ha powering spacecraft decade plan build nuclearplant mar scifi kilopower project officially started ‘ it’s named httpstcoetlfmszr aerospace spacetravel,2.0,0,0.9949883,0.005011697,NY
7054,2019-08-11 21:35:50,soooooocan conversation nuclear energy nah,5.0,2,0.12887682,0.8711232,NY
7055,2019-08-03 21:29:16,need proof liberal doomsday prognosticator claim chernobyl killed million waaaaaaaaaaay chernobyl killed people immediately exposed fallout die cancer it’s way away nuclear energy ha saved million life,0.0,0,0.963111,0.036888964,NY
7056,2019-08-03 21:22:19,seth love really want switch renewable energy wind solar expensive wholly inefficient need invest nuclear energy contrary liberal doomsday prognosticator nuclear energy much efficient solar wind,0.0,1,0.48739886,0.51260114,NY
7057,2019-07-15 20:35:28,germany say work hard phase nuclear energy coal amp lignite order programmed phase dirty energy one one really climatebreakdown hlpf,2.0,0,0.860165,0.13983503,NY
7058,2019-07-15 14:30:13,bill gate daunting nuclear energy httpstcooopmegyzu generate,0.0,0,0.64201194,0.3579881,NY
7059,2019-07-02 23:17:16,france ha probably successful nuclear energy program human history foh astroturfing bullshit,2.0,0,0.75661874,0.24338123,NY
7060,2019-06-24 15:17:25,shouldn’t trust assertion nuclear power business nuclear energy safe well isn’t safest form ‘clean’ energy monopolized owned controlled it’s really bad one sunshine 💸🤷🏻‍♀️🌞,2.0,0,0.6524068,0.34759313,NY
7061,2019-06-05 18:01:12,loving tail nuclear energy detailing,1.0,0,0.7753271,0.22467296,NY
7062,2019-05-30 02:39:58,little disturbing viewing several episode hbos chernobyl tv television drama miniseries nuclearenergy,0.0,0,0.9461891,0.053810883,NY
7063,2019-05-29 04:31:56,america ha killed people nuclear energy thats statistical fact nothing understood wrong,6.0,0,0.98352194,0.016478032,NY
7064,2019-05-28 11:11:29,watching chernobyl thinking fact rick perry charge agency oversees nuclear energy industry 😎,1.0,0,0.9773661,0.022633875,NY
7065,2019-05-20 18:11:50,school wo ac thats knew kid persevered today snowflake melt aircondition school mitigate climatechange banning fracking fossilfuels amp nuclear energy push greenewdeal,0.0,0,0.9571,0.04289997,NY
7066,2019-05-15 03:16:07,energy storage miniscule way provide baseline energy fossil fuel nuclear energy vital power source decade come trump correct,2.0,0,0.9441539,0.055846117,NY
7067,2019-05-09 02:01:41,making nuclear energy smaller cheaper safer httpstcorgufkgbgc,0.0,0,0.9891075,0.01089248,NY
7068,2019-05-08 23:12:04,dutch ambassador share kingdomnl working nuclear disarmament nonproliferation promotion peaceful use nuclear energy npt prepcom,7.0,2,0.28970456,0.71029544,NY
7069,2019-05-07 01:30:32,ph delegate allen carillo ph mission vienna stress peaceful us nuclear energy strengthen npt regime call sufficient assured predictable resource iaea technical cooperation programme rdnptprepcom unnewyork httpstcovbarzyio,5.0,2,0.25978693,0.74021304,NY
7070,2019-04-24 11:31:18,nuclear energy new poll look whether american think count clean energy httpstcoswfxurzokp,0.0,2,0.05241802,0.947582,NY
7071,2019-04-24 07:56:42,people think ai improve society think ha negative aspect point view engineering scientist would say alreay similar discussion past dynamite steamengine nuclearenergy etc doubleedged sword,3.0,2,0.10262848,0.8973715,NY
7072,2019-04-17 16:28:33,george still peddling nuclear energy,0.0,0,0.99388874,0.006111179,NY
7073,2019-03-26 00:13:58,great discussion bnefsummit covering everything u nuclear energy policy importance u lng export providing energysecurity around world httpstcodszgcggsgk,10.0,1,0.45807508,0.5419249,NY
7074,2019-03-23 07:47:42,green energy technology nowhere near point efficiently account energy need developed nation ruling nuclear energy entirety shortsighted lesson history wa dont build nuclear power station coastline,3.0,2,0.34259066,0.65740937,NY
7075,2019-03-13 21:41:53,dont need nuclear energy dangerous fukushima watch httpstcoixnkpcvp eventually need truth disclosure zeropointenergy look httpstcohvsqqsikd see unacknowledged meantime efficiency green energy hold u,0.0,0,0.944977,0.055022974,NY
7076,2017-09-02 15:48:12,jerseycitylawyer ny federal court dismisses case subsidy nuclear energy httpstcodpieiyufj httpstcomniwybwha,0.0,1,0.4851321,0.5148679,NY
7077,2017-07-17 12:30:47,episode jim clarke amp steve krahn nuclear energy httpstcokbivimdu,6.0,2,0.044400096,0.95559996,NY
7078,2016-08-02 14:49:44,i’m listening podcast episode nuclear energy want watch godzilla,0.0,0,0.9735947,0.02640526,NY
7079,2015-08-26 22:37:02,nuclear energy stock prediction httptconhoxafpuf,0.0,2,0.0979915,0.90200853,NY
7080,2015-05-08 04:11:43,evil side atlantic tiresome youre like real life mr burn nuclear energy wa medium monopoly,4.0,2,0.08496241,0.9150376,NY
7081,2015-04-28 03:45:44,delighted chairman burn announced new u pledge million renew lab peaceful us nuclear energy npt,4.0,0,0.9064774,0.093522646,NY
7082,2015-04-27 18:45:14,iaea amano amp nuclear regulatory commissn chair burn showcase peaceful us nuclear energy npt httptcorguhwewqne,4.0,2,0.0077252123,0.9922748,NY
7083,2015-04-09 02:45:25,thescienceguy also funny guy discussing nuclearenergy httptcoaturxytj,3.0,2,0.003381134,0.99661887,NY
7084,2015-04-09 02:30:33,case hiroshima strong doe argument hold nuclear radiation cancer causing nuclearenergy nextgennuc,1.0,2,0.34682706,0.6531729,NY
7085,2015-04-09 02:13:55,columbia watching pandoraspromise documentary nuclear energy followed talk billnye former iea exedir tanaka,3.0,0,0.59164596,0.4083541,NY
7086,2015-04-09 01:00:59,pandoraspromise nuclearenergy alfred lerner hall httpstcoyeobmxvsy,0.0,0,0.94840455,0.051595427,NY
7087,2015-02-06 16:45:36,executive committe nuclear energy division discussing future activity,1.0,0,0.9471293,0.052870657,NY
7088,2014-12-28 23:39:59,back future advanced nuclear energy battle climate change brookings institution httptcofhyzwnxnal,1.0,2,0.32250455,0.6774954,NY
7089,2014-12-03 21:18:40,nuclear energy institute climate rule epa right intent wrong methodology nuclear energy co value httptcoxwzljqqt,0.0,0,0.7222521,0.27774793,NY
7090,2014-11-21 22:04:55,speaking importance nuclear energy cuenergy httptcoozqetyx,0.0,2,0.05434423,0.94565576,NY
7091,2014-09-23 17:13:15,agree rt allowing china india nuclear energy market would unwise httptcozkwhsbjv,0.0,0,0.8418485,0.15815149,NY
7092,2014-09-21 15:34:29,antinuclear activist india nuclear energy neither clean green peoplesclimate httptcokjrgeocyuy,0.0,0,0.84697473,0.15302525,NY
7093,2014-08-28 18:45:21,biotech nuclear energy startup crash combinator demo day httptcowxtflvlf,1.0,2,0.32435843,0.6756416,NY
7094,2014-05-30 14:37:27,nuclear energy lot high quality training,1.0,2,0.012289258,0.9877108,NY
7095,2014-05-29 19:30:05,bklyn assemblyman amp michael benjamin met albany discus climatechange nuclear energy amp ensuring clean energy future,0.0,0,0.96266234,0.03733767,NY
7096,2014-04-22 23:38:41,michael benjamin making earthday presentation role nuclear energy httptcobxmaoiia,1.0,2,0.3045425,0.69545746,NY
7097,2014-04-19 04:59:27,bmoviemaniacs sure blame space race mutated leech nuclear energy hillbilly,3.0,0,0.89737445,0.102625534,NY
7098,2014-03-18 16:35:35,nei hw u b environmentalist amp nt support nuclear energy httptcoqyqnmzjf futureofenergy httptcofbgzg oxymoron,0.0,2,0.008009234,0.99199075,NY
7099,2014-02-23 23:27:07,cost nuclear energy extensive uranium contamination across navajo land httptcodjylpgnd,0.0,2,0.009839041,0.99016094,NY
7100,2014-02-18 16:38:00,myth nuclear energy abound bronx clergy roundtable fact safe healthy affordable reliable energy given httptcozantecrei,0.0,0,0.9638307,0.03616929,NY
7101,2014-01-19 22:44:40,according exxon commercial nuclear energy doesnt count sustainable energy blah,0.0,2,0.021510335,0.9784897,NY
7102,2013-12-27 01:01:16,nuclear energy clearly way go,0.0,0,0.5619764,0.43802366,NY
7103,2013-11-15 13:02:37,doe u supreme right deny country nuclear energy another country tell u cant enhance technology,0.0,1,0.47276846,0.5272315,NY
7104,2013-11-15 12:59:07,usa promised iran nuclear energy period shah iran developing technology war forthcoming,0.0,2,0.0059388536,0.9940612,NY
7105,2013-11-08 18:41:46,watching pandora promise cnn nuclear energy good put head leg,2.0,0,0.98034036,0.019659566,NY
7106,2013-10-01 17:54:43,iran responds israel say iran ha inalienable right peaceful nuclear energy httptcoxqtdrhelh,0.0,0,0.5514355,0.44856453,NY
7107,2013-09-27 21:08:29,obama made clear respect iran right access peaceful nuclear energy deal israel unga speech nxt week must watch,0.0,2,0.102064416,0.8979356,NY
7108,2013-09-24 15:30:43,potus unga america prefers resolve problem peacefully seeking regime change respect right nuclear energy jpost iran,0.0,0,0.6536279,0.34637213,NY
7109,2013-08-17 14:55:40,rt global renewable electricity generation overtake gas twice nuclear httptcozmanceoe energy,0.0,2,0.110008255,0.8899917,NY
7110,2013-08-12 00:27:57,real price nuclear energy httptcohpxzilmsz,0.0,0,0.9044227,0.09557732,NY
7111,2013-06-12 00:07:07,movie review ‘pandora’s promise’ advocate nuclear energy documentarian robert stone line expert httptcoklplpnrpbs,0.0,0,0.5786092,0.42139077,NY
7112,2013-06-05 13:25:22,thanks ive said yr rt hope spring eternal pandora promise amp truth nuclear energy httptcorljczon,0.0,0,0.8613592,0.13864082,NY
7113,2012-10-17 02:16:41,romney want go nuclear energy apparently hasnt heard fukishima debate,0.0,2,0.35504505,0.644955,NY
7114,2012-10-17 02:15:47,debate mitt want use nuclear energy badly right undecided voter,0.0,2,0.07181951,0.9281805,NY
7115,2012-04-06 04:05:00,mean nuclear energy idk r able handle dat yet,0.0,0,0.6858695,0.31413046,NY
7116,2012-03-10 18:25:59,meryl streep girl power source energy powerful oil coal nuclear energy wiw,1.0,2,0.42444718,0.5755529,NY
7117,2011-12-15 22:50:43,“theonion nuclear energy advocate insist u reactor completely safe unless something bad happens httptcojynlzj scitech”,0.0,2,0.064096704,0.9359033,NY
7118,2011-09-05 18:02:23,ttmghost ttmnearness bith sort feel like instructional video safety nuclear energy wo propaganda,0.0,2,0.26676247,0.73323756,NY
7119,2011-05-19 07:15:29,nuclear energy reward risk httpbitlykesikd via httpoutsidein,0.0,2,0.13946217,0.8605378,NY
7120,2011-05-19 03:45:22,nuclear energy reward risk httpbitlyirbos via httpoutsidein,0.0,2,0.24668597,0.753314,NY
7121,2011-04-07 15:05:24,segment medium hysteria nuclear energy newscorp building httpinstagrampcjfj,0.0,0,0.985965,0.014034973,NY
7122,2011-03-25 17:12:35,cut bill nye science guy wa trying say something important nuclear energy dont care,0.0,2,0.15314975,0.8468502,NY
7123,2011-03-22 11:58:38,oversight operator fukushima held responsible taken reason future nuclear energy,0.0,2,0.10545157,0.8945484,NY
7124,2011-03-16 17:15:52,crazy talkrt nuclear energy abandoning support nuclear power pushing alternativ httptlgdaiam,0.0,2,0.06446683,0.93553317,NY
7125,2011-03-14 16:14:11,smart thought offering cautious support nuclear energy compared fossil fuel httpbitlyhduvl cc,1.0,2,0.42127416,0.5787259,NY
7126,2011-03-13 02:25:31,stupid thing like tsunamiyou harboring nuclear energy come bite asssmh,0.0,0,0.9138749,0.086125106,NY
7721,2020-04-13 05:39:15,may company western pennsylvania hacked china operative technology wa taken solar energy nuclear energy american steel trade secret software technology communication technology aka g network,0.0,0,0.9086233,0.091376774,WY
7722,2020-04-07 03:28:09,solar technology software technology communication technology nuclear energy technology shortly event joe biden wa appointed head man deal ukraine shortly hunter biden took job burisma holding stayed,0.0,0,0.959481,0.04051905,WY
7723,2013-02-12 21:14:40,kid asking way many question nuclear energy weird hiddenagenda,0.0,0,0.90196157,0.098038375,WY
7724,2011-03-15 01:08:49,japan seriously rethinking nuclear energy source really worth seriously,0.0,0,0.9918222,0.008177802,WY
9947,2020-11-29 13:44:31,yeah netherlands even virulent social justuce movement reduing everything colonialism heard nuclear energy colonialism nuclear reactor symbolizes centralized system providing dangerous method power dependancy,5.0,2,0.29333425,0.70666575,WI
9948,2020-11-28 19:28:34,ballistic missile enough israel nuclear energy program nuclear weapon program israel ha proof making nuclear bomb spreading terrorism myth,0.0,2,0.3196148,0.68038523,WI
